Unnamed: 0,번호,제목,저자,출판사,출판일
,1,Understanding the materials used in foods-Food materials science,"Stanley, D. W.",Published on behalf of the Canadian Institute of Food Science and Technology by Elsevier Applied Science,1992
,2,"Food Allergens : Included here are the findings of research investigating the efficacy of cleaning regimes on eliminating gliadin and protein residues on food processing equipment and how peanut and nut allergic consumers use food packaging and labelling to assess risks from food. In addition there is a report on the global food allergy and intolerance products market, a paper on the prevalence of food allergy in Australia and a report on the ILSI Allergen Exposure Management Workshop",unknown,AUSTRALIAN INSTITUTE OF FOOD SCIENCE &amp; TECHNOLOGY,2011
,3,"Survey of Vinyl Chloride content of polyvinyl chloride for food contact and of foods. The second report of the Steering Group on food surveillance: The Working Party on Vinyl Chloride. Ministry of Agriculture, Fisheries and Food. Food Surveillance Paper No. 2. HMSO, London, 1978. pp. iv + 16. £0.60",unknown,Pergamon Press,1979
,4,"Why You Should Let Your Kids Play With Their Food What happens when you reduce salt, sugar and fat in food? Does sweet food make you happier? What's in latest food flavour sensation matcha?",unknown,AUSTRALIAN INSTITUTE OF FOOD SCIENCE & TECHNOLOGY,2017
,5,Obesity: America's Number One Food Issue: Who is responsible for the problem? The solution? What role do food ingredients and food formulations play? Prepared Foods' annual ``R&amp;D Trends Survey: Weight Management Formulations'' offers insights and queries food product developers on these questions,unknown,DELTA COMMUNICATIONS INC,2011
,6,"The Rise of Food Renegades With financial support from Silicon Valley and a growing distrust of `Big Food' by Millennials, entrepreneurial companies are disrupting the food chain through product innovation, storytelling, and home delivery services","Despain,  David",INSTITUTE OF FOOD TECHNOLOGISTS,2016
,7,"The surveillance of food contamination in the United Kingdom. The first report of the Steering Group on food surveillance: Ministry of Agriculture, Fisheries and Food. Food Surveillance Paper No. 1. HMSO, London, 1978. pp. v + 38. £0.90",unknown,Pergamon Press,1979
,8,Traditional foods: challenges facing the European food industry,"Jordana, J.",Published on behalf of the Canadian Institute of Food Science and Technology by Elsevier Applied Science,2000
,9,Scientific Committee for Food: Procedures and Programmes for European Food Safety,"Van der Heijden, C. A.",Malaysian Institute of Food Technology,1990
,10,Determination of Low Levels of Aziridine in Food-Simulating Liquids by Capillary Gas Chromatography,"Demertzis, P. G.; Franz, R.; Piringer, O.",Elsevier,1994
,11,Fermented foods and food safety,"Nout, M. J. R.",Published on behalf of the Canadian Institute of Food Science and Technology by Elsevier Applied Science,1994
,12,"Comfort Food Re-boot: Comfort foods have been known as near-polar opposites of ``health'' foods. However, today's ingredient technology has brought specialty oils, fat replacers, sodium reducers, functional starches and more into the creation of comfort items consumers know and love. These include mac 'n cheese, pot pies, green bean casserole; or perhaps something sweet, such as a Devil's Food cake, banana cream pie, an apple turnover or cherry pie",unknown,DELTA COMMUNICATIONS INC,2013
,13,Factors Affecting Food Away from Home: Are Food-Secure and Food-Insecure Households Different?,"Pan, S.; Jensen, H. H.; Malaga, J.",FDRS FOOD DISTRIBUTION RESEARCH SOCIETY,2007
,14,Reducing salt in food: Leatherhead Food International has joined forces with the food industry to investigate salt reduction in food,"Block, R. W.",EXPOCONSULT PUBLISHERS,2004
,15,"Exploring the relationship among food-related values, food-related lifestyle and food-related behavior as lever for changing dietary habits of food desert residents","Thomas,  T.; Gunden,  C.",TEKNOSCIENZE S.R.L.,2017
,16,IFST Appropriate Food Technology Group: Fair Traded Foods/Maya Gold Chocolate - Case study of a successful fair-traded product,"Wright, S.",IFST,1995
,17,"C-Stores Raise the Bar on Convenience Foods: As tobacco sales fall and higher gas prices lead to less driving, convenience stores shift their attention to growing their food/beverage and foodservice segments with an eye on elevating product variety and quality","Hensel, K.",INSTITUTE OF FOOD TECHNOLOGISTS,2012
,18,"Food Ingredients for Outer Beauty: Foods for beauty and health remain popular. Attendees of Prepared Foods' 2009 R&amp;D Applications Seminars-East heard information on ingredients that help protect skin from sun damage, water loss, oxidative stress and other damaging environmental factors",unknown,DELTA COMMUNICATIONS INC,2010
,19,"The SAFE FOODS framework for integrated risk analysis of food: An approach designed for science-based, transparent, open and participatory management of food safety","Knudsen, I.","Elsevier Science B.V., Amsterdam.",2010
,20,Energy Prices Up-Food Prices Up-What is the Impact on Aquatic Food?,unknown,FOOD PRODUCTS PRESS,2008
,21,Food-Security Status and Food-Purchase Decisions of Low-Income Households in Tennessee,"Tegegne, F.; Godwin, S.; Speller-Henderson, L.; Dirkson, M.",FDRS FOOD DISTRIBUTION RESEARCH SOCIETY,2005
,22,Are pulses poor man's food or a future super food?,unknown,AUSTRALIAN INSTITUTE OF FOOD SCIENCE & TECHNOLOGY,2016
,23,DNA-based methods for detection of food-borne bacterial pathogens,"Olsen, J. E.",Published on behalf of the Canadian Institute of Food Science and Technology by Elsevier Applied Science,2000
,24,Migration of fluorochemical paper additives from food-contact paper into foods and food simulants,"Begley, T. H.; Hsu, W.; Noonan, G.; Diachenko, G.",Taylor & Francis,2008
,25,Iron deficiency and iron fortified foods-a review,"Martinez-Navarrete, N.;Camacho, M. M.;Martinez-Lahuerta, J.;Martinez-Monzo, J.;Fito, P.",Published on behalf of the Canadian Institute of Food Science and Technology by Elsevier Applied Science,2002
,26,"Food Science, 3D Focus Prepared Foods' R&D Seminars explore food, beverage trends and technologies",unknown,DELTA COMMUNICATIONS INC,2015
,27,Food‐grade carrageenans and their implications in health and disease,"Liu, Fang; Hou, Pengfen; Zhang, Hui; Tang, Qingjuan; Xue, Changhu; Li, Robert W.",Wiley-Blackwell,2021
,28,Determination of protein in foods: comparison of net protein and crude protein (N x 6.25) value,"Salo-Vaeaenaenen, P. P.; Koivistoinen, P. E.",Elsevier,1995
,29,"Givaduan has developed new proprietary technology that will help food manufacturers address the issue of high salt levels in processed food. As part of its TasteSolutions&trade; program, Givaudan has developed an extensive portfolio of building blocks and ingredients to help its flavourists enhance salt perception in low sodium applications",unknown,AUSTRALIAN INSTITUTE OF FOOD SCIENCE &amp; TECHNOLOGY,2009
,30,Food chemical safety: the need for a new 'whole food' approach?,"Lindsay, D. G.",INSTITUTE OF FOOD SCIENCE & TECHNOLOGY,1998
,31,Street Food: Crossing Cultures with Local Inspiration A look inside the street food and street-inspired restaurants in Los Angeles provides a glimpse of how the next wave of street food in America might take shape,unknown,WEEKS PUBLISHING CO.,2011
,32,"Experimental and numerical simulations of the flow of ""liquid foods"" in rotating cans","Hughes, J. P.; James, P. W.; Jones, T. E. R.","Zurich:; ETH Zurich, Laboratory of Food Process Engineering,",2000
,33,"Food Policy, Trade, Markets, and Genetically Modified Foods: A Review of the Literature on the Science, Technology, Politics, and Economics of Labeling","Ekanem, E.; Mafuyai-Ekanem, M.",FDRS FOOD DISTRIBUTION RESEARCH SOCIETY,2004
,34,"Food, Medicine & Health Gene Silencing Technology and Food: RNA Interference Is Coming of Age","Clemens, Roger",INSTITUTE OF FOOD TECHNOLOGISTS,2015
,35,"Parental feeding practices, food neophobia, and child food preferences: What combination of factors results in children eating a variety of foods?","Kaar, Jill L.; Shapiro, Allison L.B.; Fell, Donna M.; Johnson, Susan L.","Elsevier Science B.V., Amsterdam.",2016
,36,Functional Foods: Beverages with oats and continued growth in Greek-style yogurt products are two trends in functional food,unknown,AUSTRALIAN INSTITUTE OF FOOD SCIENCE & TECHNOLOGY,2013
,37,Migration by `direct' or `indirect' food contact? `Dry' and `wetting' foods? Experimental data for `touching' contact of dry foods with paper and board,"Eicher, A.; Biedermann, M.; Zurfluh, M.; Grob, K.",Taylor & Francis,2015
,38,Migration by ‘direct’ or ‘indirect’ food contact? ‘Dry’ and ‘wetting’ foods? Experimental data for ‘touching’ contact of dry foods with paper and board,"Eicher, Angela; Biedermann, Maurus; Zurfluh, Michael; Grob, Koni",Taylor & Francis,2015
,39,Food-handling Behaviors of Student Volunteers in a University Food Recovery Program,unknown,International Association for Food Protection,2018
,40,Let food be thy medicine and medicine be thy food: A bibliometric analysis of the most cited papers focusing on nutraceuticals and functional foods,"Yeung, Andy Wai Kan; Mocan, Andrei; Atanasov, Atanas G.","Elsevier Science B.V., Amsterdam.",2018
,41,Assessing Management Perspectives of a Safe Food-handling Label for Casual Dining Take-out Food,"Surgeoner, B.V.; MacLaurin, T.; Powell, D.A.",International Association for Food Protection,2009
,42,The Business Challenge of Positioning Products at the Food/Drug Interface,"Wrick, K. L.",Expoconsult Publishers,1991
,43,"Sustainable food, ethical consumption and responsible innovation: insights from the slow food and ""low carbon food"" movements in Taiwan","Lin, Yi-Chieh",Taylor & Francis,2020
,44,Food Waste and Upcycled Foods: Can a Logo Increase Acceptance of Upcycled Foods?,"Bhatt, Siddharth; Ye, Hongjun; Deutsch, Jonathan; Jeong, Haeyoung; Zhang, Jintao; Suri, Rajneesh",Taylor & Francis,2021
,45,No such thing as unhealthy food? We take a look at the industry double-speak,unknown,FOOD COMMISSION (UK) LTD,2003
,46,Risk-benefit analysis of foods: methods and approaches,"Martinson, N.",Tekno Scienze,2006
,47,"Plant Foods: This feature touches on a wide range of developments in this important food category - from product launches to consumer issues, business initiatives and research",unknown,AUSTRALIAN INSTITUTE OF FOOD SCIENCE & TECHNOLOGY,2007
,48,Hospital food: a painful groundhog day,unknown,FOOD COMMISSION (UK) LTD,2009
,49,Minimally processed foods are more satiating and less hyperglycemic than ultra-processed foods: a preliminary study with 98 ready-to-eat foods,"Fardet, A.",Royal Society of Chemistry,2016
,50,Food-handling Practices and Operators' Food Safety Attitudes at Faith-based Louisiana Organizations That Provided Hurricane Evacuee Shelters in 2005,"Kwon, J.; Ryu, D.; Zottarelli, L. K.",International Association for Food Protection,2007
,51,Encounters with Extreme Foods: Neophilic/Neophobic Tendencies and Novel Foods,"Veeck, A.",FOOD PRODUCT PRESS,2010
,52,The Business of Food: Preserving Culinary Traditions Keeps the Family Fed in the Philippines,"Lim-Castillo, P.","Bristol:; Footwork,",2003
,53,Development and use of microbiological criteria for foods: Guidance for those involved in using and interpreting microbiological criteria for foods,unknown,INSTITUTE OF FOOD SCIENCE & TECHNOLOGY,1997
,54,Chemical Contaminants in Foods: Health Risks and Public Perception Knowing what types of information consumers are looking for may be the first step in helping to better explain potential risks and restore trust in the food supply,"Lipp,  Markus; Chase,  Christina G.",INSTITUTE OF FOOD TECHNOLOGISTS,2015
,55,Virtuous Food: `Conscientious Production' as Moral Imperative,"DeSoucey, M.; Fine, G.A.",Totnes; Prospect,2008
,56,Prevalence of the main food-borne pathogens in retail food under the national food surveillance system in Japan,"Hara-Kudo, Y.; Konuma, H.; Kamata, Y.; Miyahara, M.; Takatori, K.; Onoue, Y.; Sugita-Konishi, Y.; Ohnishi, T.",Taylor & Francis,2013
,57,Food allergy with special reference to genetically modified foods: a review,"Nayak, S.K.",ASSOC OF FOOD SCIENTISTS &amp; TECHNOLOGISTS (INDIA),2008
,58,Wild Food: The Call of the Domestic,"Albala, K.","Totnes, Devon:; Prospect books,",2004
,59,"Food-related personality traits, food choice motives and food intake: Mediator and moderator relationships","Eertmans, A.; Victoir, A.; Vansant, G.; Van den Bergh, O.","Elsevier Science B.V., Amsterdam.",2005
,60,Food-poverty status and food insecurity in rural West Lombok based on mothers' food expenditure equivalency,"Rosalina, T.; Wibowo, L.; Kielmann, A. A.; Usfar, A. A.",UNITED NATIONS UNIVERSITY PRESS,2007
,61,Food Microbe Tracker: A Web-Based Tool for Storage and Comparison of Food-Associated Microbes,"Vangay, P.; Fugett, E.B.; Sun, Q.; Wiedmann, M.",INTERNATIONAL ASSOCIATION FOR FOOD PROTECTION,2013
,62,Metal Contamination of Food-Its Significance for Food Quality and Human Health,"Kitts, D. D.",Published on behalf of the Canadian Institute of Food Science and Technology by Elsevier Applied Science,2003
,63,Wild Plant Foods: Panacea or just a Picnic?,"Robbins, C.","Totnes, Devon:; Prospect books,",2004
,64,But I saw it on TV!' - How do you get children to eat real food?,"Whiting, M.","Bristol:; Footwork,",2003
,65,"Consumer Trends and Marketing State and national dairy awards promote dairy food quality to the consumer, Sunny Queen show that `an egg a day is OK' and New Zealand researchers track consumer attitudes to meat based foods. We also report on local and inte",unknown,FOOD AUSTRALIA,2003
,66,Public perception of nanotechnology in foods: Nanotechnology has huge potential in both foods and food packaging,unknown,REED BUSINESS INFORMATION,2010
,67,Toxicological evaluation of certain veterinary drug residues in food: Prepared by the Forty-eighth meeting of the Joint FAO/WHO Expert Committee on Food Additives (JECFA),unknown,FOOD AND AGRICULTURAL ORGANIZATION,1997
,68,Food Safety from Farm to Table... A National Food-Safety Initiative Report to the President!,00,IAMFES INTER ASSN MILK FOOD ENVIR SANITARIANS,1997
,69,Thought for food: innovation and entrepreneurship in the Food Industry. Simon Dale explains the role of the SEEDA-supported Food Technology Enterprise Hub,unknown,BOSTON HANNAH COMMUNICATIONS,2007
,70,"Healthier Fried Foods: Since American consumers insist on eating fried foods, we owe it to their health and to our bottom lines to improve fried foods via healthier oils with longer shelf life, improved coatings and better frying techniques",unknown,WEEKS PUBLISHING CO.,2011
,71,Food-packaging interactions influencing quality and safety,"Hotchkiss, J. H.",Taylor & Francis,1996
,72,Food-handling Behaviors Student Volunteers in a University Food Recovery Program,H. Lester Schonberger; Renee R. Boyer; Melissa W. Chase,International Association for Food Protection,2018
,73,Medical Foods: Food or Drug?,"Ockhuizen, T.",Process Press Europe,1994
,74,Migration by 'direct' or 'indirect' food contact? 'Dry' and 'wetting' foods? Experimental data for 'touching' contact of dry foods with paper and board,"Eicher, Angela; Biedermann, Maurus; Zurfluh, Michael; Grob, Koni",Taylor & Francis,2015
,75,"Convenience Foods: The convenience food sector is one of the most dynamic, with sales of frozen foods on the increase",unknown,TARA PUBLISHING CO LTD,1997
,76,Organic food: nutritious food or food for thought? A review of the evidence,"Magkos, F.; Arvaniti, F.; Zampelas, A.",MACMILLAN PRESS LTD,2003
,77,Halal Foods: A Slice Of The Halal Pie - The halal market is an untapped treasure trove that holds much potential for food manufacturers of both Muslim and non-Muslim countries,"Lim, C.",AP FOOD INDUSTRY PUBLICATIONS PTE LTD,2008
,78,Objective and Subjective Impediments to the Use of Food Stamps by Food-Insecure Households,"Ejimakor, G.; Acharaeke, O.",FDRS FOOD DISTRIBUTION RESEARCH SOCIETY,2006
,79,"A CO~2OL supplier Not just plain carbon dioxide, but food-grade liquid CO2, dry ice plus other value-added services are Hydrogas Malaysia's calling card to food processors in the country",unknown,AP FOOD INDUSTRY PUBLICATIONS PTE LTD,2000
,80,Discrete Choice Analysis of the Factors Affecting Food-Imports Refusals by the Food and Drug Administration,"Allen, A. J.; Shaik, S.; Myles, A.",FDRS FOOD DISTRIBUTION RESEARCH SOCIETY,2007
,81,The Beauty Of Black Foods: Black is beautiful and black foods are now attracting attention,"Thevis, H.",AP FOOD INDUSTRY PUBLICATIONS PTE LTD,2008
,82,"Speaking Out on Functional Foods In a unique Prepared Foods' Industry Survey, the technical, marketing and sales personnel at food companies","Fels, J.; Klemenz, M.",DELTA COMMUNICATIONS INC,2003
,83,Safety of Street Foods: Case Study of A Food Plaza in Delhi,"Bajaj, P.; Mathur, P.; Sharma, S.",ASSOCIATION OF FOOD SCIENTISTS & TECHNOLOGISTS,2002
,84,Wellness Foods: India's New Opportunity There is a growing recognition of the potential role for wellness foods in helping to reduce health risks and improve health quality,unknown,THE ALL INDIAN FOOD PRESERVERS ASSOCIATION,2008
,85,"GM Foods: Labelling &amp; Testing For GM food producers and importers, engaging a reliable third-party testing and inspection body will allow them to gain access to export markets and shorten their time-to-market by meeting the labelling requirements of their importing companies","Yoong, C.K.",AP FOOD INDUSTRY PUBLICATIONS PTE LTD,2012
,86,``Raw food'' diet: the effect of maximal temperature (46 ± 1 °C) on aflatoxin B~1 and oxalate content in food,"Bavcon Kralj,  M.; Podrażka,  M.; Krawczyk,  B.; Pandel Mikuš,  R.; Jarni,  K.; Trebše,  P.",VUP FOOD RESEARCH INSTITUTE,2017
,87,Health foods: Future of Indian food industry,"Pai, J.S.",ASSOCIATION OF FOOD SCIENTISTS &amp; TECHNOLOGISTS,2007
,88,"Forging a functional framework Food companies, regulatory authorities and consumers alike are struggling to make sense of the phenomenon known as `functional foods'. What can countries in southeast and East Asia learn from the experience of markets in the",unknown,AP FOOD INDUSTRY PUBLICATIONS PTE LTD,2000
,89,"Nutraceuticals/Functional Foods: At The Crossroads: Crossing the divide between the agri-food, cosmetics and pharmaceutical industries offers much potential",unknown,AP FOOD INDUSTRY PUBLICATIONS PTE LTD,2008
,90,"Trends in Prepared Foods for Foodservice: The second annual Prepared Foods' ""Foodservice Product Development Trends Survey"" finds several issues and developments of concern to food manufactures offering products to foodservices",unknown,DELTA COMMUNICATIONS INC,2006
,91,Special Issue on Ready to Eat Foods: Proceedings of the National Seminar on ``Ready to Eat Foods-Prospects'' held on 15-16 November 2007 at New Delhi,unknown,THE ALL INDIAN FOOD PRESERVERS ASSOCIATION,2008
,92,A Food Classification Scheme to Summarize Epidemiological Patterns of Food-borne Illness,"Fraser, A. M.",IAMFES INTER ASSN MILK FOOD ENVIR SANITARIANS,1995
,93,A Comparison of Household Food-Security Status and Dietary Intake of Food Box Recipients in Middle Tennessee,"Godwin, S.; Tegegne, F.; Speller-Henderson, L.",FDRS FOOD DISTRIBUTION RESEARCH SOCIETY,2003
,94,"Flavorings in Food: Ministry of Agriculture, Fisheries and Food, United Kingdom","Love, J. A.",IAMFES INTER ASSN MILK FOOD ENVIR SANITARIANS,1997
,95,The Future of Food: Prepared Foods' New Products Conference featured three leaders in the industry offering their perspectives on the future of foods and beverages,unknown,DELTA COMMUNICATIONS INC,2007
,96,"Defending Functional Foods: Functional foods are gathering enough momentum to overtake the entire food industry. In time, manufacturers may expect to hear more of the consumer battle cry for fortification and enrichment",unknown,DELTA COMMUNICATIONS INC,2006
,97,"Orphan Food? Nay, Future of Food ! Understanding the Pulse of the Indian Market","Deodhar,  Satish Y.",ASSOCIATION OF FOOD SCIENTISTS & TECHNOLOGISTS,2016
,98,"Raw materials: There's a new trend appearing in the health food world - raw food. Dr Sarah Houlton asks, will it ever make it into the mainstream food sector?",unknown,EXPOCONSULT PUBLISHERS,2012
,99,Analysis of Consumer Food-Handling Practices from Grocer to Home Including Transport and Storage of Selected Foods,"Godwin, S. L.; Coppings, R. J.",FDRS FOOD DISTRIBUTION RESEARCH SOCIETY,2005
,100,"Nutraceuticals in Processed Foods and Supplements: Results from ``Prepared Foods' 2011 R&amp;D Trends Survey: Functional Foods and Beverages'' show targeting health conditions range in boldness, while regulatory staffs influence ingredient choices",unknown,DELTA COMMUNICATIONS INC,2011
,1,"Moisture distribution and loss in microwave heating of foods: effect of food structure, initial moisture level and surface conditions","Ni, H.; Datta, A.",Sheffield Academic Press,1997
,2,"First Person: A Product Developer's Perspective A new feature! Prepared Foods discusses Asian food trends with Jean Lee, R&amp;D director for Windsor Foods' Golden Tiger business",unknown,DELTA COMMUNICATIONS INC,2013
,3,Characterization of Enterococci from Food and Food-Related Settings,"Soares-Santos,  Verónica; Barreto,  António Salvador; Semedo-Lemsaddek,  Teresa",INTERNATIONAL ASSOCIATION FOR FOOD PROTECTION,2015
,4,IUFoST Symposium 9: Functional Foods-Safety and Efficacy: The Impact of Regulation on Informing Consumers about the Health Promoting Properties of Functional Foods in the U.S.A,"Falk, M.",INSTITUTE OF FOOD TECHNOLOGISTS,2004
,5,"Egg and Milk Proteins as Hidden Allergens in Food: 5-Year (2010 to 2014) Results of Food Allergen Monitoring in Piedmont, Italy","Bianchi,  Daniela Manila; Adriano,  Daniela; Astegiano,  Sara; Gallina,  Silvia; Caramelli,  Maria; Decastelli,  Lucia",INTERNATIONAL ASSOCIATION FOR FOOD PROTECTION,2016
,6,Migration of Dibenzoate Plasticizers and Polyethylene Terephthalate Cyclic Oligomers from Microwave Susceptor Packaging into Food-Simulating Liquids and Food,TIMOTHY H. BEGLEY; HENRY C. HOLLIFIELD,"International Association of Milk, Food, and Environmental Sanitarians",1990
,7,MOLECULAR DIAGNOSTICS IN FOOD SAFETY: RAPID DETECTION OF FOOD-BORNE PATHOGENS,"Smith, T. J.",AGRICULTURE AND FOOD DEVELOPMENT AUTHORITY,2000
,8,Detection of Noroviruses in Foods: A Study on Virus Extraction Procedures in Foods implicated in Outbreaks of Human Gastroenteritis,"Rutjes, S. A.; Lodder-Verschoor, F.; van der Poel, W. H. M.; van Duijnhoven, Y. T. H. P.; de Roda Husman, A. M.",INTERNATIONAL ASSOCIATION FOR FOOD PROTECTION,2006
,9,What is food‐to‐food fortification? A working definition and framework for evaluation of efficiency and implementation of best practices,"Kruger, Johanita; Taylor, John R. N.; Ferruzzi, Mario G.; Debelo, Hawi",Wiley-Blackwell,2020
,10,Irradiation as a method for decontaminating food: A review,"Farkas, J.",Elsevier,1998
,11,"Application of subtyping by combined allozyme, whole-cell protein and antibiotic resistance analysis in epidemiological investigations of food-borne infections","Thurm, V.; Dinger, E.",Elsevier,1993
,12,"Improving iron and zinc bioaccessibility through food-to-food fortification of pearl millet with tropical plant foodstuffs (moringa leaf powder, roselle calyces and baobab fruit pulp)",Reneè van der Merwe; Johanita Kruger,Association of Food Scientists & Technologists,2019
,13,"Migration of plasticizers from PVC gaskets of lids for glass jars into oily foods: Amount of gasket material in food contact, proportion of plasticizer migrating into food and compliance testing by simulation","Fankhauser-Noti, A.; Grob, K.","Elsevier Science B.V., Amsterdam.",2006
,14,"Thermal Inactivation of Salmonella Agona in Low—Water Activity Foods: Predictive Models for the Combined Effect of Temperature, Water Activity, and Food Component","Jin, Yuqiao; Pickens, Shannon R.; Hildebrandt, Ian M.; Burbick, Stephen J.; Grasso-Kelley, Elizabeth M.; Keller, Susanne E.; Anderson, Nathan M.",INTERNATIONAL ASSOCIATION FOR FOOD PROTECTION,2018
,15,A Real-Time PCR Assay for the Detection of Salmonella in a Wide Variety of Food and Food-Animal Matrices,"Bohaychuk, V. M.; Gensler, G. E.; McFall, M. E.; King, R. K.; Renter, D. G.",INTERNATIONAL ASSOCIATION FOR FOOD PROTECTION,2007
,16,"Animal Feeds and Pet Foods: Recent Developments Food Technology Review No. 50, 1979, C. S. Sodano","Lawlor, M. J.",TEAGASC-Agriculture and Food Development Authority,1979
,17,Use of Polymerase Chain Reaction (PCR) in food control: Detection of genetically modified food and food-borne pathogens,"Greiner, R.; Jany, K.-D.",POLISH ACADEMY OF SCIENCES,2002
,18,Understanding the oral processing of solid foods: Insights from food structure,"Guo, Qing",Wiley-Blackwell,2021
,19,"The adaptive response of bacterial food-borne pathogens in the environment, host and food: Implications for food safety","Alvarez-Ordóñez, A.; Broussolle, V. r.; Colin, P.; Nguyen-The, C.; Prieto, M.","Elsevier Science B.V., Amsterdam.",2015
,20,Inactivation of foodborne pathogens by the synergistic combinations of food processing technologies and food‐grade compounds,"Zhang, Hongchao; Tikekar, Rohan V.; Ding, Qiao; Gilbert, Andrea R.; Wimsatt, Stratton T.",Wiley-Blackwell,2020
,21,Viral Inactivation in Foods: A Review of Traditional and Novel Food-Processing Technologies,"Hirneisen, K. A.; Black, E. P.; Cascarino, J. L.; Fino, V. R.; Hoover, D. G.; Kniel, K. E.",BLACKWELL PUBLISHING LTD,2010
,22,Food Safety Could self-inspection programs lead to safer foods?,unknown,PETER N HAVENS,2003
,23,"New Governance: Can User-Promulgated Certification Schemes Provide Safer, Higher Quality Food?","Hass, T.K.",Food and Drug Law Institute; 1999,2013
