Unnamed: 0,번호,제목,저자,출판사,출판일
,63,A New Approach to Predict the Water-transport Properties of Multilayer Films Intended for Food-packaging Applications,"Del Nobile, M. A.; Buonocore, G. G.; Dainelli, D.; Nicolais, L.",INSTITUTE OF FOOD TECHNOLOGISTS,2004
,64,"Connected Community and Household Food-Based Strategy (CCH-FBS): Its Importance for Health, Food Safety, Sustainability and Security in Diverse Localities","Wahlqvist, M.",Taylor & Francis,2009
,65,Phytochemical Profiles and Antimicrobial Activity of Aromatic Malaysian Herb Extracts against Food-Borne Pathogenic and Food Spoilage Microorganisms,"Aziman, N.; Abdullah, N.; Noor, Z. M.; Kamarudin, W. S.; Zulkifli, K. S.",Blackwell Publishing Ltd,2014
,66,Dietary fibre in foods: a review,"Dhingra, D.; Michael, M.; Rajput, H.; Patil, R. T.",ASSOC OF FOOD SCIENTISTS & TECHNOLOGISTS (INDIA),2012
,67,Drying of fat rich liquid foods: A review,"Jena, S.; Das, H.",ASSOC OF FOOD SCIENTISTS & TECHNOLOGISTS (INDIA),2007
,68,Solute Transfer in Osmotic Dehydration of Vegetable Foods: A Review,Sahylin Muñiz-Becerá; Lilia L. Méndez-Lagunas; Juan Rodríguez-Ramírez,Institute of Food Technologists,2017
,69,Development and Application of a Nested Polymerase Chain Reaction Method for the Detection of Genetically Modified Soybean in Chinese Traditional Fermented Soy Food-sufu,"Huang, C.-C.; Shih, T.-W.; Pan, T.-M.",NATIONAL LABORATORIES OF FOODS AND DRUGS,2004
,70,"Proximate composition, nutritional evaluation and functional properties of a promising food: Arabian wax Cissus (Cissus rotundifolia Forssk) leaves",Wedad Q. AL-Bukhaiti; Anwar Noman; Amer Ali Mahdi,Association of Food Scientists & Technologists,2019
,71,Effect of iodized salt on organoleptic properties of processed foods: a systematic review,Jessica L. Blankenship; Greg S. Garrett,Association of Food Scientists & Technologists,2018
,72,Functional components and medicinal properties of food: a review,"Abuajah, C. I.; Ogbonna, A. C.; Osuji, C. M.",ASSOC OF FOOD SCIENTISTS & TECHNOLOGISTS (INDIA),2015
,73,Extended-spectrum beta-lactamase (ESBL) producing and multidrug-resistant Escherichia coli in street foods: a public health concern,"M. Sivakumar, G. Abass, R. Vivekanandhan, Anukampa, D. K. Singh, Kiran Bhilegaonkar, Suman Kumar, M. R. Grace, Zunjar Dubal",Association of Food Scientists & Technologists,2021
,74,"Listeria monocytogenes Persistence in Food-Associated Environments: Epidemiology, Strain Characteristics, and Implications for Public Health","Ferreira, V.; Wiedmann, M.; Teixeira, P.; Stasiewicz, M.J.",INTERNATIONAL ASSOCIATION FOR FOOD PROTECTION,2014
,75,Mixed Cultures of Food-grade Probiotic Bacteria and Enteric Bacteria Demonstrate Both Synergism and Inhibition of Menaquinone Production,"Parker, P.; Jones, G.; Smith, S.",INSTITUTE OF FOOD TECHNOLOGISTS,2003
,76,Use of Molecular Technology in the Detection and Characterisation of Food-borne Pathogens,unknown,AGRICULTURE AND FOOD DEVELOPMENT AUTHORITY,2001
,77,"Formulation, Characterization and Stability Assessment of a Food-Derived Tripeptide, Leucine-Lysine-Proline Loaded Chitosan Nanoparticles",Minna K. Danish; Giuliana Vozza; Hugh J. Byrne; Jesus M. Frias; Sinéad M. Ryan,Institute of Food Technologists,2017
,78,Meat Products as Functional Foods: A Review,"Fernandez-Gines, J. M.; Fernandez-Lopez, J.; Sayas-Barbera, E.; Perez-Alvarez, J. A.",INSTITUTE OF FOOD TECHNOLOGISTS,2005
,79,"Phthalate Esters in Foods: Sources, Occurrence, and Analytical Methods","Cao, X. L.",BLACKWELL PUBLISHING LTD,2010
,80,"Use of ultrasounds in the food industry–Methods and effects on quality, safety, and organoleptic characteristics of foods: A review",Ioannis S. Arvanitoyannis; Konstantinos V. Kotsanopoulos ; Amalia G. Savva,CRC Press,2017
,81,Application of ozone for degradation of mycotoxins in food: A review,"Afsah‐Hejri, Leili; Hajeb, Parvaneh; Ehsani, Reza J.",Wiley-Blackwell,2020
,82,"Pyrosequencing analysis of microbial community and food-borne bacteria on restaurant cutting boards collected in Seri Kembangan, Malaysia, and their correlation with grades of food premises","Abdul-Mutalib, N. A.; Amin Nordin, S.; Osman, M.; Ishida, N.; Tashiro, K.; Sakai, K.; Tashiro, Y.; Maeda, T.; Shirai, Y.","Elsevier Science B.V., Amsterdam.",2015
,83,Standardized methods for testing the quality attributes of plant‐based foods: Milk and cream alternatives,"Grossmann, Lutz; Kinchla, Amanda J.; Nolden, Alissa; McClements, David Julian",Wiley-Blackwell,2021
,84,UV treatment for degradation of chemical contaminants in food: A review,"He, Jiang; Evans, Natasha Marie; Liu, Huaizhi; Zhu, Yan; Zhou, Ting; Shao, Suqin",Wiley-Blackwell,2021
,85,Prolamin‐based complexes: Structure design and food‐related applications,"Song, Jingru; Sun, Cuixia; Gul, Khalid; Mata, Analucia; Fang, Yapeng",Wiley-Blackwell,2021
,86,"Application of Alternative Food-Preservation Technologies to Enhanced Food Safety and Stability. Antonio Bevilacqua, Maria Rosaria Corbo, and Milena Sinigagliou, eds.","Rahman, M.",Taylor & Francis,2011
,87,Radiation sensitivity of planktonic and biofilm‐associated shigella spp. and aeromonas spp. on food and food‐contact surfaces,"Nagar, Vandan; Pansare Godambe, Lipika; Shashidhar, Ravindranath",Wiley-Blackwell,2017
,88,Antibiotic-Resistant Bacteria: Prevalence in Food and Inactivation by Food-Compatible Compounds and Plant Extracts,"Friedman,  Mendel",ACS AMERICAN CHEMICAL SOCIETY,2015
,89,"Use of ultrasounds in the food industry–Methods and effects on quality, safety, and organoleptic characteristics of foods: A review","Arvanitoyannis, Ioannis S.; Kotsanopoulos, Konstantinos V.; Savva, Amalia G.",Taylor & Francis,2017
,90,Nutraceuticals and Functional Foods: The Foods for the Future World,"Gul, Khalid; Singh, A. K.; Jabeen, Rifat",Taylor & Francis,2016
,91,Validation of process technologies for enhancing the safety of low‐moisture foods: A review,"Wason, Surabhi; Verma, Tushar; Subbiah, Jeyamkondan",Wiley-Blackwell,2021
,92,Reproducibility and validity of a food-frequency questionnaire (NFFQ) to assess food consumption based on the NOVA classification in adults,"Dinu, Monica; Bonaccio, Marialaura; Martini, Daniela; Madarena, Maria Pia; Vitale, Marilena; Pagliai, Giuditta; Esposito, Simona; Ferraris, Cinzia; Guglielmetti, Monica; Rosi, Alice; Angelino, Donato",Informa Healthcare,2021
,93,Texture Modification Technologies and Their Opportunities for the Production of Dysphagia Foods: A Review,"Sungsinchai, Sirada; Niamnuy, Chalida; Wattanapan, Pattra; Charoenchaitrakool, Manop; Devahastin, Sakamon",Wiley-Blackwell,2019
,94,Escherichia coli biotransformation of daidzein fermentation products from soy‐based foods—relevance to food oestrogenicity‐based functionality,"Ye, Hui; Dudley, Samantha Z.; Shaw, Ian C.",Wiley-Blackwell,2017
,95,Organic and functional foods: their emergence and impact on conventional food production,"Schrauzer, G. N.","Nottingham:; Nottingham University Press,",2003
,96,Pulse‐based snacks as functional foods: Processing challenges and biological potential,"Escobedo, Alejandro; Mojica, Luis",Wiley-Blackwell,2021
,97,Vitamin profile of cooked foods: how healthy is the practice of ready-to-eat foods?,"Agte, V.; Tarwadi, K.; Mengale, S.; Hinge, A.; Chiplonkar, S.",MACMILLAN PRESS LTD,2002
,98,"Interaction of a Food-Grade Cationic Surfactant (Lauric Arginate) with Food-Grade Biopolymers (Pectin, Carrageenan, Xanthan, Alginate, Dextran, and Chitosan)","Bonnaud, M.; Weiss, J.; McClements, D.J.",ACS AMERICAN CHEMICAL SOCIETY,2010
,99,Electronic irradiation of foods: an introduction to the technology. A Springer Food Engineering series publication,"Brennan, C.",Blackwell Publishing Ltd,2006
,100,"Furan and Methylfurans in Foods: An Update on Occurrence, Mitigation, and Risk Assessment","Kettlitz, Beate; Scholz, Gabriele; Theurillat, Viviane; Cselovszky, Jörg; Buck, Neil R.; O' Hagan, Sue; Mavromichali, Eva; Ahrens, Katja; Kraehenbuehl, Karin; Scozzi, Gabriella; Weck, Markus; Vinci, Claudia; Sobieraj, Marta; Stadler, Richard H.",Wiley-Blackwell,2019
,1,Antimicrobial Activity of Trifoliate Orange (Poncirus trifoliate) Seed Extracts on Gram-Negative Food-bome Pathogens,"Kim, S.Y.; Shin, K.-S.",KOREAN SOCIETY OF FOOD SCIENCE AND NUTRITION,2012
,2,Dietary N‐epsilon‐carboxymethyllysine as for a major glycotoxin in foods: A review,"Chen, Gengjun",Wiley-Blackwell,2021
,3,"The science of plant‐based foods: Constructing next‐generation meat, fish, milk, and egg analogs","McClements, David Julian; Grossmann, Lutz",Wiley-Blackwell,2021
,4,Malondialdehyde Measurement in Oxidized Foods: Evaluation of the Spectrophotometric Thiobarbituric Acid Reactive Substances (TBARS) Test in Various Foods,"Papastergiadis, A.; Mubiru, E.; Van Langenhove, H.; De Meulenaer, B.",ACS AMERICAN CHEMICAL SOCIETY,2012
,5,Determination of Bisphenol-A in Reusable Polycarbonate Food-Contact Plastics and Migration to Food-Simulating Liquids,"Biles, J. E","American Chemical Society, Books and Journals Division",1997
,6,Can we predict who adopts health-promoting foods? Users of functional foods in Finland,"Niva, M.",Taylor & Francis,2006
,7,Simplified Enzymatic High-Performance Anion Exchange Chromatographic Determination of Total Fructans in Food and Pet Food-Limitations and Measurement Uncertainty,"Stober, P.; Benet, S.; Hischenhuber, C.",ACS AMERICAN CHEMICAL SOCIETY,2004
,8,Study of the Migration of Photoinitiators Used in Printed Food-Packaging Materials into Food Simulants,"Sanches-Silva, A.; Andre, C.; Castanheira, I.; Cruz, J.M.; Pastorelli, S.; Simoneau, C.; Paseiro-Losada, P.",ACS AMERICAN CHEMICAL SOCIETY,2009
,9,"Enrichment of chips with fibre from a tiger‐nut (Cyperus esculentus) milk co‐product at 'source of fibre foods' and 'high fibre content foods' levels: impact on processing, physico‐chemical and sensory properties","Alava, Cecibel; Verdú, Samuel; Barat, José M.; Grau, Raúl",Wiley-Blackwell,2019
,10,Quantitation of Sensory-Active and Bioactive Constituents of Food: A Journal of Agricultural and Food Chemistry Perspective,"Schieberle, P.; Molyneux, R.J.",ACS AMERICAN CHEMICAL SOCIETY,2012
,11,Should Red Wine Be Considered a Functional Food?,"Yoo, Y. J.; Saliba, A. J.; Prenzler, P. D.",BLACKWELL PUBLISHING LTD,2010
,12,Application of Deep Learning in Food: A Review,"Zhou, Lei; Zhang, Chu; Liu, Fei; Qiu, Zhengjun; He, Yong",Wiley-Blackwell,2019
,13,Does Information on Food Production Technology Affect Consumers' Acceptance of Biofortified Foods? Evidence from a Field Experiment in Kenya,"Okello, Julius J.; Lagerkvist, Carl Johan; Muoki, Penina; Heck, Simon; Prain, Gordon",Taylor & Francis,2018
,14,Harmful effects of junk foods - But what about canteen and restaurant food?,unknown,"John Wiley & Sons, Ltd",2011
,15,"Use of novel PCR primers specific to the genes of staphylococcal enterotoxin G, H, I for the survey of Staphylococcus aureus strains isolated from food-poisoning cases and food samples in Taiwan","Chen, T. R.; Chiou, C. S.; Tsen, H. Y.","Elsevier Science B.V., Amsterdam.",2004
,16,Scalping of Flavors in Packaged Foods:,"Sajilata, M. G.; Savitha, K.; Singhal, R. S.; Kanetkar, V. R.",BLACKWELL PUBLISHING LTD,2007
,17,Comprehensive Database of Carotenoid Contents in Ibero-American Foods. A Valuable Tool in the Context of Functional Foods and the Establishment of Recommended Intakes of Bioactives,"Dias, M. Graça; Olmedilla-Alonso, B.; Hornero-Méndez, D.; Mercadante, A. Z.; Osorio, C.; Vargas-Murga, L.; Meléndez-Martínez, A. J.",ACS AMERICAN CHEMICAL SOCIETY,2018
,18,Total volatile basic nitrogen and trimethylamine in muscle foods: Potential formation pathways and effects on human health,"Bekhit, Alaa El‐Din A.; Giteru, Stephen G.; Holman, Benjamin W. B.; Hopkins, David L.",Wiley-Blackwell,2021
,19,In Vitro Digestion of Betalainic Foods. Stability and Bioaccessibility of Betaxanthins and Betacyanins and Antioxidative Potential of Food Digesta,"Tesoriere, L.; Fazzari, M.; Angileri, F.; Gentile, C.; Livrea, M.A.",ACS AMERICAN CHEMICAL SOCIETY,2008
,20,Worldwide aflatoxin contamination of agricultural products and foods: From occurrence to control,"Jallow, Abdoulie; Xie, Huali; Tang, Xiaoqian; Qi, Zhang; Li, Peiwu",Wiley-Blackwell,2021
,21,Application of nanoemulsion‐based approaches for improving the quality and safety of muscle foods: A comprehensive review,"Das, Arun K.; Nanda, Pramod Kumar; Bandyopadhyay, Samiran; Banerjee, Rituparna; Biswas, Subhasish; McClements, David Julian",Wiley-Blackwell,2020
,22,Development of vitamin E‐enriched functional foods: stability of tocotrienols in food systems,"Pandya, Janam K.; DeBonee, Maryssa; Corradini, Maria G.; Camire, Mary Ellen; McClements, David Julian; Kinchla, Amanda J.",Wiley-Blackwell,2019
,23,Migration of Components from Cork Stoppers to Food: Challenges in Determining Inorganic Elements in Food Simulants,"Corona, T.; Iglesias, M.; Antico, E.",ACS AMERICAN CHEMICAL SOCIETY,2014
,24,Sourdough Technology-A Traditional Way for Wholesome Foods: A Review,"Chavan, R. S.; Chavan, S. R.",BLACKWELL PUBLISHING LTD,2011
,25,Influence of hydrocolloids in low moisture foods- a food polymer science approach,"Levine, H.; Slade, L.",IRL PRESS,2004
,26,Development and validation of a short food-frequency questionnaire for screening women of childbearing age for vitamin A status in northwestern Iran,"Omidvar, N.; Ghazi-Tabatabie, M.; Harrison, G. G.; Eghtesadi, S.; Mahboob, S.-A.; Pourbakht, M.",UNITED NATIONS UNIVERSITY PRESS,2002
,27,The effect of cooking on veterinary drug residues in food: Nicarbazin (Dinitrocarbanilide component),"Tarbin, J. A.; Bygrave, J.; Bigwood, T.; Hardy, D.; Rose, M.; Sharman, M.",TAYLOR & FRANCIS,2005
,28,Consumer concepts in new product development of local foods: Traditional versus novel honeys,"Stolzenbach, S.; Bredie, W. L. P.; Byrne, D. V.","Elsevier Science B.V., Amsterdam.",2013
,29,Justifying the need to prescribe limits for toxic metal contaminants in food-grade silver foils,"Das, M.; Dixit, S.; Khanna, S. K.",TAYLOR & FRANCIS,2005
,30,Volatile and non-volatile radiolysis products in irradiated multilayer coextruded food-packaging films containing a buried layer of recycled low-density polyethylene,"Chytiri, S.; Goulas, A. E.; Badeka, A.; Riganakos, K. A.; Kontominas, M. G.",TAYLOR & FRANCIS,2005
,31,Analysis of furan in foods. Is headspace sampling a fit-for-purpose technique?,"Senyuva, H. Z.; Gokmen, V.",TAYLOR & FRANCIS,2005
,32,The practical analysis of food: The development of Sakalar quantification table of DNA (SQT-DNA),"Şakalar, E. n.","Elsevier Science B.V., Amsterdam.",2013
,33,How to Label ‘Natural’ Foods: a Matter of Complexity,"Sandin, P.",Springer Science + Business Media,2017
,34,Food-cobalamin malabsorption in elderly patients,"Andres, E.; Federici, L.; Affenberger, S.; Zimmer, J.; Loukili, N. H.; Wirtz, G.; Kaltenbach, G.",TEKNOSCIENZE S.R.L.,2006
,35,Examining Artisan: The descriptor ``artisan'' is appearing on menus and product labels with increasing frequency. But what does artisan really mean-and can it find acceptance in connection with chain restaurants and processed foods?,unknown,WEEKS PUBLISHING CO.,2011
,36,Snack Foods: Mantelli's launches delectable cookies without sugar,unknown,NATIONAL PUBLISHING PTY LTD,2007
,37,Methods for the determination of European Union-permitted added natural colours in foods: a review,"Scotter, M. J.",Taylor & Francis,2011
,38,Evaluating Matrix Effects in the Analysis of Polycyclic Aromatic Hydrocarbons from Food: Can These Interferences Be Neglected for Isotope Dilution?,"Belo, R. F.; Pissinatti, R.; Souza, S. V.; Junqueira, R. G.",Springer Science + Business Media,2017
,39,Convenience Foods: Unilever launches instant bouillon paste,unknown,NATIONAL PUBLISHING PTY LTD,2008
,40,Antimicrobial residues survey by LC-MS in food-producing animals in Lebanon,"Mokh, Samia; El Hawari, Khaled; Rahim, Haifa Abdul; Al Iskandarani, Mohamad; Jaber, Farouk",Taylor + Francis,2020
,41,The hidden 'plant side' of insect novel foods: A DNA-based assessment,"Frigerio, Jessica; Agostinetto, Giulia; Sandionigi, Anna; Mezzasalma, Valerio; Berterame, Nadia Maria; Casiraghi, Maurizio; Labra, Massimo; Galimberti, Andrea","Elsevier Science B.V., Amsterdam.",2020
,42,Plasticizers in Brazilian food-packaging materials acquired on the retail market,"De A. Freire, M. T.; Santana, I. A.; Reyes, F. G. R.",TAYLOR & FRANCIS,2006
,43,Functional foods: Consumer willingness to compromise on taste for health?,"Verbeke, W.","Elsevier Science B.V., Amsterdam.",2006
,44,"Consumer expectations, liking and willingness to pay for specialty foods: Do sensory characteristics tell the whole story?","Stefani, G.; Romano, D.; Cavicchi, A.","Elsevier Science B.V., Amsterdam.",2006
,45,Filth and Other Foreign Objects in Food: A Review of Analytical Methods and Health Significance,"Gorham, J. R.; Zurek, L.",MARCEL DEKKER AG,2006
,46,"Relatedness of Lactobacillus rhamnosus Strains Isolated from Clinical Specimens and such from Food-stuffs, Humans and Technology","Baumgartner, A.",ACADEMIC PRESS - JOURNALS DEPARTMENT,1998
,47,MIGRESIVES: a research project on migration from adhesives in food-packaging materials in support of European legislation and standardization,"Stormer, A.; Franz, R.",Taylor & Francis,2009
,48,Aryl hydrocarbon receptor activation and CYP1A induction by cooked food-derived carcinogenic heterocyclic amines in human HepG2 cell lines,"Sekimoto, M.; Sumi, H.; Hosaka, T.; Umemura, T.; Nishikawa, A.; Degawa, M.","Elsevier Science B.V., Amsterdam.",2016
,49,Nucleic acid-based biotechnologies for food-borne pathogen detection using routine time-intensive culture-based methods and fast molecular diagnostics,"Souii, A.; M’hadheb-Gharbi, M. B.; Gharbi, J.",Springer Science + Business Media,2016
,50,"Migration of cyclo-diBA from coatings into canned food: Method of analysis, concentration determined in a survey and in silico hazard profiling","Biedermann, S.; Zurfluh, M.; Grob, K.; Vedani, A.; Brüschweiler, B. J.","Elsevier Science B.V., Amsterdam.",2013
,51,Inhibition effects of carvacrol on biogenic amines formation by common food-borne pathogens in histidine decarboxylase broth,"Ozogul, F.; Kacar, C.; Hamed, I.","Elsevier Science B.V., Amsterdam",2015
,52,Analytical methods for the screening of potential volatile migrants from acrylic-base adhesives used in food-contact materials,"Nerin, C.; Canellas, E.; Aznar, M.; Silcock, P.",Taylor & Francis,2009
,53,Diverse food-based applications of nuclear magnetic resonance (NMR) technology,"Marcone, M. F.; Wang, S.; Albabish, W.; Nie, S.; Somnarain, D.; Hill, A.","Elsevier Science B.V., Amsterdam.",2013
,54,Evaluation of Food-derived Functional Ingredients According to Activation of PPAR and Suppression of COX-2 Expression,"Nakata, R.; Takizawa, Y.; Takai, A.; Inoue, H.",KARGER,2013
,55,Dietary exposure assessment of Danish consumers to dithiocarbamate residues in food: A comparison of the deterministic and probabilistic approach,"Jensen, B. H.; Andersen, J. H.; Petersen, A.; Christensen, T.",Taylor & Francis,2008
,56,Laila's fine foods: `Authentic' east is best in the northwest,unknown,IML GROUP PLC,2008
,57,Food-Grade Colloidal Systems for the Delivery of Essential Oils,"Milad Fathi, Marko Vinceković, Slaven Jurić, Marko Viskić, Anet Režek Jambrak & Francesco Donsì",M. Dekker,2021
,58,"Migration of lactic acid, lactide and oligomers from polylactide food-contact materials","Mutsuga, M.; Kawamura, Y.; Tanamoto, K.",Taylor & Francis,2008
,59,JAPAN: the birthplace of functional foods. But will they sell in Europe?,unknown,WILLIAM REED PUBLISHING,2007
,60,The analytical determination of polyphosphates in food: A point-to-point comparison between direct ion chromatography and indirect photometry,"Iammarino, Marco; Haouet, Naceur; Di Taranto, Aurelia; Berardi, Giovanna; Benedetti, Ferdinando; Di Bella, Sara; Chiaravalle, Antonio Eugenio","Elsevier Science B.V., Amsterdam.",2020
,61,FDA seeks comment on new food-drug prohibition,unknown,AGRA INFORMA INC,2008
,62,Religious and ethnic foods: halal,unknown,REED BUSINESS INFORMATION,2009
,63,Use of emoticon and emoji in tweets for food-related emotional expression,"Vidal, Leticia; Ares, Gastón; Jaeger, Sara R.","Elsevier Science B.V., Amsterdam.",2016
,64,Predicting mycotoxins in foods: A review,"Garcia, D.; Ramos, A. J.; Sanchis, V.; Marin, S.","Elsevier Science B.V., Amsterdam",2009
,65,"In vitro control of multiplication of some food-associated bacteria by thyme, rosemary and sage isolates","Ivanovic, J.; Misic, D.; Zizovic, I.; Ristic, M.","Elsevier Science B.V., Amsterdam.",2012
,66,Identification of a transcriptomic signature of food-relevant genotoxins in human HepaRG hepatocarcinoma cells,"Kreuzer, Katrin; Böhmert, Linda; Alhalabi, Deema; Buhrke, Thorsten; Lampen, Alfonso; Braeuning, Albert","Elsevier Science B.V., Amsterdam.",2020
,67,Effects of the components of two antimicrobial emulsions on food-borne pathogens,"Ferreira, J. P.; Alves, D.; Neves, O.; Silva, J.; Gibbs, P. A.; Teixeira, P. C.","Elsevier Science B.V., Amsterdam.",2010
,68,Adding condiments to foods: How does static and dynamic sensory perception change when bread and carrots are consumed with mayonnaise?,"van Eck, Arianne; Fogliano, Vincenzo; Galindo-Cuspinera, Verónica; Scholten, Elke; Stieger, Markus","Elsevier Science B.V., Amsterdam.",2019
,69,The consequences of physical post-treatments (microwave and electron-beam) on food/packaging interactions: A physicochemical and toxicological approach,"Riquet, A. M.; Breysse, C.; Dahbi, L.; Loriot, C.; Severin, I.; Chagnon, M. C.","Elsevier Science B.V., Amsterdam.",2016
,70,Migration of mineral oil from party plates of recycled paperboard into foods: 1. Is recycled paperboard fit for the purpose? 2. Adequate testing procedure,"Dima, G.; Verzera, A.; Grob, K.",Taylor & Francis,2011
,71,Application of FTIR and Raman microspectroscopy to the study of food/packaging interactions,"Mauricio-Iglesias, M.; Guillard, V.; Gontard, N.; Peyron, S.",Taylor & Francis,2009
,72,Frozen Food: Components and Chemical Reactions,"Lim, M. H.; McFetridge, J. E.; Liesebach, J.",MARCEL DEKKER AG,2006
,73,Food-Grade Colloidal Systems for the Delivery of Essential Oils,"Fathi, Milad; Vinceković, Marko; Jurić, Slaven; Viskić, Marko; Režek Jambrak, Anet; Donsì, Francesco",Taylor & Francis,2021
,74,Variation in risk judgment on radiation contamination of food: Thinking trait and profession,"Honda, Hidehito; Ogawa, Midori; Murakoshi, Takuma; Masuda, Tomohiro; Utsumi, Ken; Nei, Daisuke; Wada, Yuji","Elsevier Science B.V., Amsterdam.",2015
,75,Insects as food: Exploring cultural exposure and individual experience as determinants of acceptance,Hui Shan Grace Tan;Arnout R.H. Fischer; Patcharaporn Tinchan; Markus Stieger; L.P.A. Steenbekkers; Hans C.M. van Trijp,Longman Scientific & Technical,2015
,76,Exposure of the Irish population to PBDEs in food: consideration of parameter uncertainty and variability for risk assessment,"Trudel, D.; Tlustos, C.; von Goetz, N.; Scheringer, M.; Reichert, P.; Hungerbuhler, K.",Taylor & Francis,2011
,77,Fabrication of food-grade nanofibers of whey protein Isolate–Guar gum using the electrospinning method,"Aman mohammadi, Masoud; Ramazani, Soghra; Rostami, Mohammadreza; Raeisi, Mojtaba; Tabibiazar, Mahnaz; Ghorbani, Marjan","Elsevier Science B.V., Amsterdam.",2019
,78,Adsorption of the bacteriocins produced by Lactobacillus curvatus CRL705 on a multilayer-LLDPE film for food-packaging applications,"Massani, M. B.; Vignolo, G. M.; Eisenberg, P.; Morando, P. J.","Elsevier Science B.V., Amsterdam",2013
,79,"Super Nutrients: As researchers increasingly find evidence of compounds that confer health benefits, consumers are clamoring to see these so-called super nutrients in their foods. To ensure products deliver health and good taste, product designers need to optimize the formulation and the process",unknown,WEEKS PUBLISHING CO.,2013
,80,Mode of action based risk assessment of the botanical food-borne alkenylbenzene apiol from parsley using physiologically based kinetic (PBK) modelling and read-across from safrole,"Alajlouni, A. M.; Al_Malahmeh, A. J.; Kiwamoto, R.; Wesseling, S.; Soffers, A. E.; Al-Subeihi, A. A.; Vervoort, J.; Rietjens, I. M.","Elsevier Science B.V., Amsterdam.",2016
,81,Measuring consumers attitudes towards health and taste and their association with food-related life-styles and preferences,"Saba, A.; Sinesio, F.; Moneta, E.; Dinnella, C.; Laureati, M.; Torri, L.; Peparaio, M.; Saggia Civitelli, E.; Endrizzi, I.; Gasperi, F.; Bendini, A.; Gallina Toschi, T.; Predieri, S.; Abbà, S.; Bailetti, L.; Proserpio, C.; Spinelli, S.","Elsevier Science B.V., Amsterdam.",2019
,82,"Survey of formaldehyde, acetaldehyde and oligomers in polyethylene terephthalate food-packaging materials","Mutsuga, M.; Tojima, T.; Kawamura, Y.; Tanamoto, K.",TAYLOR & FRANCIS,2005
,83,"Fabrication, characterization and lipase digestibility of food-grade nanoemulsions","Troncoso, E.; Aguilera, J. M.; McClements, D. J.","Elsevier Science B.V., Amsterdam.",2012
,84,Use of overall migration methodology to test for food-contact substances with specific migration limits,"Bradley, E. L.; Castle, L.; Jickells, S. M.; Mountfort, K. A.; Read, W. A.",Taylor & Francis,2009
,85,Thermal Processing of Foods: Principles and Applications,"Marks, B. P.",MARCEL DEKKER AG,2006
,86,"The effectiveness of food-borne diseases training among clinicians in Guangdong, China","Huang, Q.; Wang, X.; Lu, L.; Deng, X.; Chen, Z.; Liang, J.; Li, J.; Huang, X.; Zhang, Y.; Yang, X.","Elsevier Science B.V., Amsterdam.",2013
,87,Inactivation of food-related microorganisms in liquid environment by pulsed xenon flash light treatment system,"Ogihara, H.; Morimura, K.; Uruga, H.; Miyamae, T.; Kogure, M.; Furukawa, S.","Elsevier Science B.V., Amsterdam.",2013
